{
  "ok": true,
  "code": "OK",
  "ms": 3.2,
  "result": {
    "count": 42,
    "model": "gpt-4.1-mini",
    "breakdown": {
      "system": 5,
      "user": 37,
      "assistant": 0,
      "tool": 0
    }
  },
  "protocol": "llm/v1.0",
  "component": "llm",
  "schema_version": "1.0.1",
  "request_id": "req_tok_001"
}
