{
  "ok": true,
  "code": "OK",
  "ms": 42.1,
  "result": {
    "text": "DOC_123: ... DOC_456: ...",
    "model": "gpt-4.1-mini",
    "model_family": "gpt",
    "usage": {
      "prompt_tokens": 38,
      "completion_tokens": 24,
      "total_tokens": 62
    },
    "finish_reason": "stop",
    "warnings": []
  },
  "protocol": "llm/v1.0",
  "component": "llm",
  "schema_version": "1.0.1",
  "request_id": "req_01HX8KVP5W",
  "result_hash": "2f9a0f8a7c06c0f3f7c9b89b684c7c3f6c0d643bc5a3d8b62d6f5a2ce0f4d3b2",
  "warnings": []
}
